,Channel_name,Video_title,Video_url,Detailed_Summary,One_Line_Summary,Video_Source,Video_Type,Video_Title,View_Count,Publish_Date,Video_Length,Author
26,Benjamin Cowen,Ethereum: Dubious Speculation,https://www.youtube.com/watch?v=ViE1kDzYskY,"The transcript presents a bearish outlook on Ethereum, with the speaker maintaining the view that Ethereum will ultimately decline and return to its ""lower fair value regression band."" The speaker argues that Ethereum could experience a significant correction of around 65-75% from its recent highs, potentially reaching levels around $500-$745, which would be a lower low compared to previous lows. This is based on the speaker's analysis of Ethereum's historical price movements and the tendency for ""pre-halving"" years in the cryptocurrency market to see a ""wreck"" of both bulls and bears.

The speaker also discusses the Ethereum-Bitcoin (ETH/BTC) pair, suggesting that the Ethereum Bitcoin valuation is likely to continue declining, which could mark the ""end of the altcoin Reckoning."" The speaker believes that the lack of liquidity in the altcoin market is propping up Ethereum and Bitcoin, and once that liquidity dries up, it could lead to a broader market decline.

The speaker highlights the importance of monitoring metrics like the 20-month moving average of the ETH/BTC ratio and the total value locked (TVL) in the crypto ecosystem, as these can provide signals about the market's direction. The speaker also suggests that the altcoin market has been collectively leading back to Bitcoin, and that the dominance of Bitcoin will finally break out once the Ethereum-Bitcoin valuation breaks down, marking the ""penultimate stage of the altcoin Reckoning.""

Overall, the transcript presents a bearish sentiment, with the speaker expecting Ethereum to experience a significant correction and the broader altcoin market to face further declines before any potential recovery.","The video presents a bearish outlook on Ethereum, expecting a 65-75% correction and the end of the ""altcoin Reckoning"".",https://www.youtube.com/watch?v=ViE1kDzYskY,Youtube,Ethereum: Dubious Speculation,43086,2023-06-07 00:00:00,1401,Benjamin Cowen
27,Benjamin Cowen,Gross Domestic Income,https://www.youtube.com/watch?v=5KuB_HBRZCM,"The video transcript discusses the concept of Gross Domestic Income (GDI) and how it differs from Gross Domestic Product (GDP). The speaker explains that GDI measures the total income generated by a country, including wages, profits, and taxes, while GDP measures the economy's production of goods, services, and technology. 

The speaker argues that using both GDP and GDI can provide a more comprehensive understanding of the economy's performance. The transcript highlights that during the first half of 2022, when there were two consecutive quarters of negative GDP growth, the speaker was vocal in stating that this does not necessarily constitute a recession, as the unemployment rate remained low.

The speaker then delves into the historical trends of GDI, noting that the quarter-over-quarter percentage change in GDI has not turned negative, unlike real GDP. However, the speaker acknowledges that when adjusting for inflation, the year-over-year percentage change in real GDI has recently turned negative, suggesting a slowdown in the economy.

The speaker emphasizes the importance of considering inflation when analyzing economic metrics, as it can provide a more accurate picture of the underlying economic conditions. The transcript suggests that the speaker is taking a cautious, data-driven approach to assessing the state of the economy, rather than relying solely on the traditional GDP metric.

Overall, the sentiment of the transcript is somewhat bearish, as the speaker acknowledges the recent negative trends in real GDI and the potential for a prolonged economic slowdown, particularly when accounting for inflation. The main message and conclusion of the transcript is that analyzing both GDP and GDI, while considering the impact of inflation, can provide a more comprehensive understanding of the economy's performance.","The video discusses the difference between GDP and GDI, emphasizing the importance of analyzing both metrics and accounting for inflation to assess economic performance.",https://www.youtube.com/watch?v=5KuB_HBRZCM,Youtube,Gross Domestic Income,14506,2023-06-02 00:00:00,482,Benjamin Cowen
28,Benjamin Cowen,S&amp;P 500 Risk Metric,https://www.youtube.com/watch?v=4hMorJEt6Qo,"The transcript discusses the S&P 500 risk metric and how it can be used to navigate equity markets. The speaker explains that the S&P 500 risk metric is currently at 0.572, which is higher than the recent low of 0.36 in 2022 and 2021 levels of 0.8-0.9, indicating elevated risk in the market. The speaker suggests using a dynamic dollar-cost averaging (DCA) strategy, where the amount invested is increased as the risk level decreases, to take advantage of low-risk environments. This strategy involves having cash set aside to deploy when the risk level reaches certain thresholds, such as below 0.6, 0.5, 0.4, and so on. The speaker also notes that the current high-interest-rate environment makes it easier to hold cash for this purpose, as money market funds and short-term CDs can now provide meaningful yields. The overall sentiment of the transcript is cautiously bullish, as the speaker acknowledges the potential for market downturns but suggests a disciplined approach to take advantage of low-risk opportunities. The main message is that having a well-defined strategy to navigate market risk can be beneficial for long-term investment success.","The S&P 500 risk metric indicates elevated market risk, suggesting a dynamic dollar-cost averaging strategy.",https://www.youtube.com/watch?v=4hMorJEt6Qo,Youtube,S&P 500 Risk Metric,20845,2023-05-30 00:00:00,982,Benjamin Cowen
29,Benjamin Cowen,Bitcoin Dominance,https://www.youtube.com/watch?v=q9eH0UKydds,"The video transcript discusses the current state of the Bitcoin dominance, which refers to the percentage of the overall cryptocurrency market capitalization that Bitcoin holds. The speaker believes that the Bitcoin dominance is likely to continue increasing in the coming months, as the altcoin market is expected to systematically bleed back to Bitcoin.

The speaker provides several technical analysis points to support this view. Firstly, the Bitcoin dominance has been holding support at key levels, such as the 20-week and 100-day moving averages, indicating strength in the Bitcoin market. Additionally, the Bitcoin dominance is currently trading near the upper end of its Bollinger Bands, suggesting a potential breakout to the upside.

The speaker also discusses the Bitcoin and Ethereum dominance combined, which has already broken out above a key resistance level from August 2021. The speaker speculates that this combined dominance could potentially reach 80%, as the blue-chip cryptocurrencies continue to outperform the broader altcoin market.

The overall sentiment of the transcript is bullish on Bitcoin and the Bitcoin dominance, as the speaker believes that the altcoin market will continue to underperform compared to Bitcoin. The speaker suggests that investors should focus their cryptocurrency exposure on Bitcoin during this phase of the market cycle, as the altcoin market is likely to bleed back to Bitcoin.

In summary, the main message of the transcript is that the Bitcoin dominance is expected to continue increasing, as the altcoin market systematically weakens against Bitcoin, and that investors should consider allocating more of their cryptocurrency exposure to Bitcoin during this phase of the market cycle.","The Bitcoin dominance is likely to increase as the altcoin market weakens, suggesting investors should focus on Bitcoin.",https://www.youtube.com/watch?v=q9eH0UKydds,Youtube,Bitcoin Dominance,37540,2023-05-17 00:00:00,842,Benjamin Cowen
