,Channel_name,Video_title,Video_url,Detailed_Summary,One_Line_Summary,Video_Source,Video_Type,Video_Title,View_Count,Publish_Date,Video_Length,Author
8,Benjamin Cowen,Bitcoin: Dubious Speculation,https://www.youtube.com/watch?v=RSF3ywcKUeE,"The transcript discusses the recent movements in Bitcoin's price and its relationship with the broader cryptocurrency market, particularly altcoins. The speaker analyzes the similarities and differences between the current price action and the period leading up to the launch of the Bitcoin spot ETF in January. He suggests that the weakening of the altcoin market, which has been a significant source of liquidity for Bitcoin, may be contributing to the slight deviation in Bitcoin's price behavior compared to the previous pattern.

The speaker emphasizes the importance of Bitcoin dominance as the key to understanding the broader trends in the cryptocurrency market. He advises that during periods of quantitative tightening and high interest rates, it is prudent to be heavily invested in Bitcoin rather than altcoins, as Bitcoin dominance tends to increase regardless of market conditions. The speaker further elaborates on the historical patterns of Bitcoin's price behavior around the month of April, noting that the cryptocurrency has often seen local tops during this period. He suggests that this could be a potential scenario for the current market, especially if the altcoin pairs continue to weaken.

The transcript also discusses the potential scenarios for Bitcoin's price movement leading up to the upcoming halving event. The speaker suggests that the outcome may depend on the performance of altcoin pairs, as a breakdown in these pairs could lead to a deeper correction in Bitcoin's price, similar to what was observed in 2019. However, he acknowledges the difficulty in predicting the short-term price movements and emphasizes the importance of a long-term, disciplined approach to investing in cryptocurrencies.

The transcript also provides insights into the potential impact of the upcoming Federal Reserve policy changes, such as the transition from quantitative tightening to quantitative easing. The speaker suggests that during periods of loose monetary policy, altcoins tend to outperform Bitcoin, while the opposite is true during times of tightening. He advises that maintaining a Bitcoin-heavy portfolio may be the most prudent approach during periods of market uncertainty.

Overall, the transcript presents a cautious and analytical perspective on the current state of the cryptocurrency market, with a focus on the role of Bitcoin dominance and the potential impact of altcoin performance and Federal Reserve policy changes on Bitcoin's price.","Bitcoin's price behavior is closely tied to the broader cryptocurrency market, particularly altcoins. Maintaining a Bitcoin-heavy portfolio is prudent during periods of market uncertainty.",https://www.youtube.com/watch?v=RSF3ywcKUeE,Youtube,Bitcoin: Dubious Speculation,71279,2024-04-13 00:00:00,4276,Benjamin Cowen
9,Benjamin Cowen,Bitcoin: Social Risk,https://www.youtube.com/watch?v=-Kn2JEBoRes,"The video transcript discusses the concept of ""social risk"" in the cryptocurrency market, which is a metric that tracks interest and engagement within the crypto space. The presenter argues that the current social risk level of 0.262 suggests that there is still room for the market to run, as the social risk has not yet reached the high-risk territory near 1.0 that typically signals a market cycle top.

The presenter has expanded the number of YouTube channels and Twitter accounts tracked to provide a more comprehensive view of retail interest. The data shows that while subscriber growth and view counts for crypto YouTube channels have declined from their peaks, they are still elevated compared to previous lows. Similarly, the growth in Twitter followers for crypto-related accounts has slowed, with some accounts even seeing negative growth due to what appears to be a platform-wide issue.

The presenter ties the social risk metric to monetary policy, noting that it tends to bottom when the Federal Reserve pauses rate hikes, as investors become more willing to take on risk. However, the presenter argues that in the current high-interest rate, quantitative tightening environment, the social risk may struggle to maintain elevated levels unless Bitcoin price continues to make new highs on a regular basis. Otherwise, the presenter suggests that the social risk could fall back into the 0.0-0.2 range, which would likely coincide with a further increase in Bitcoin dominance as altcoins bleed against BTC.

The presenter believes that this scenario, if it plays out, would be similar to the 2019 market cycle, where Bitcoin dominance topped out after the social risk put in a secondary bottom. The presenter suggests that this could happen again later this year as the Fed eventually cuts rates, potentially marking the end of the current Bitcoin dominance cycle.

The presenter also discusses the concept of the ""altcoin reckoning,"" arguing that it is not about the devaluation of all USD pairs, but rather the devaluation of all Bitcoin pairs. The presenter notes that many altcoins, including Ethereum, are currently putting in new lows against Bitcoin, suggesting that the altcoin reckoning has not yet ended. The presenter believes that this could lead to further underperformance of altcoins against Bitcoin in the near term, but also suggests that it could set the stage for an eventual altcoin resurgence once the Fed shifts to a more accommodative policy stance.","The video discusses social risk in the cryptocurrency market, suggesting room for the market to run as risk levels have not reached high-risk territory. The presenter ties social risk to monetary policy, noting it may struggle without Bitcoin price making new highs, potentially leading to increased Bitcoin dominance.",https://www.youtube.com/watch?v=-Kn2JEBoRes,Youtube,Bitcoin: Social Risk,25546,2024-04-13 00:00:00,1457,Benjamin Cowen
10,Benjamin Cowen,Cardano Outlook,https://www.youtube.com/watch?v=VOJdqSwFgBU,"The refined and expanded summary is as follows:

The transcript presents a detailed analysis of the Cardano (ADA) cryptocurrency and its performance relative to Bitcoin. The speaker expresses a bearish sentiment, arguing that altcoins like ADA will continue to bleed against Bitcoin during periods of quantitative tightening (QT) by the Federal Reserve.

The key points made in the transcript are:

1. The speaker's bias has been that altcoins will bleed against Bitcoin since 2022, and this view has been playing out, with larger altcoins like Ethereum and Cardano testing support against Bitcoin. The speaker believes that the primary driver of altcoin performance is the monetary policy environment, with altcoins tending to outperform Bitcoin during periods of quantitative easing (QE) and underperforming during QT.

2. The speaker provides historical examples, showing that Cardano's bottom against Bitcoin in the previous cycle coincided with the Fed's pivot from QT to QE, and not any specific Cardano-related developments. Currently, the speaker believes Cardano is approaching a crucial support level of 800 sats against Bitcoin, and their base case is that it will break below this level, as the Fed remains in a QT environment.

3. The speaker acknowledges the possibility of a temporary bounce in Cardano's price against Bitcoin, but maintains that the overall trend will be downward for Cardano against Bitcoin, unless the Fed pivots back to QE. The speaker provides historical examples of altcoin performance during periods of QT, showing that altcoins tend to bleed against Bitcoin as higher-risk assets are sold off in favor of the lower-risk Bitcoin.

4. The speaker also discusses the potential impact of the upcoming Bitcoin halving event, noting that if Cardano's price against Bitcoin is unable to keep up with a potential Bitcoin rally leading up to the halving, it could lead to a breakdown in Cardano's support against Bitcoin, which could then result in further losses when Bitcoin eventually corrects.

5. The speaker acknowledges that Cardano's USD valuation is more puzzling, as it will depend on the overall performance of Bitcoin. The speaker suggests that if Bitcoin rallies, it could lift Cardano's USD price, but maintains that exposure to Bitcoin may be a better strategy than holding Cardano directly, given the altcoin's tendency to bleed against Bitcoin during periods of QT.

6. The speaker provides additional context and analysis, including a comparison of Cardano's performance against Bitcoin and Ethereum over the past several quarters, as well as a discussion of Cardano's dominance and risk levels. The speaker also examines historical patterns of altcoin performance during periods of shifting monetary policy, suggesting that Cardano may need to test lower support levels before a potential reversal can occur.

In summary, the transcript presents a comprehensive and data-driven bearish outlook on Cardano's performance against Bitcoin, primarily driven by the speaker's belief that altcoins will continue to bleed during the current QT environment, rather than any specific factors related to Cardano. The additional context provided in the transcript further reinforces the speaker's analysis and outlook.",Altcoins like Cardano likely to underperform Bitcoin during Fed's quantitative tightening.,https://www.youtube.com/watch?v=VOJdqSwFgBU,Youtube,Cardano Outlook,42483,2024-04-12 00:00:00,4007,Benjamin Cowen
11,Benjamin Cowen,Bitcoin On-Chain: HODL Waves,https://www.youtube.com/watch?v=VRkaOo6Garo,"The video transcript discusses the ""Hodl waves"" or long-term and short-term holding patterns of Bitcoin investors. The key points are:

1. When Bitcoin breaches new highs, the long-term Hodl wave (investors holding for over 6 months) starts to drop as these long-term holders start selling to short-term holders. This has happened consistently at major Bitcoin price tops in 2017, 2019, 2020, and 2021.

2. Currently, the long-term Hodl wave has dropped from 79% in December 2021 to 71% in April 2022, indicating that long-term holders are selling. This suggests Bitcoin may be entering a topping pattern, similar to previous cycles.

3. Conversely, the short-term Hodl wave (investors holding for less than 6 months) has been increasing, from 21% in December 2021 to almost 29% in April 2022, as short-term speculators buy in.

4. The presenter suggests watching for a breakdown in all Bitcoin trading pairs (BTC pairs) to around 0.39 or below, as this could signal an impending pullback, similar to what was seen around the Bitcoin ETF launch in 2021.

5. Overall, the transcript has a cautiously bearish sentiment, as it highlights the typical selling behavior of long-term Bitcoin holders at market tops. The presenter suggests the current cycle may be following a similar pattern to previous ones.

In summary, the main message is that the on-chain data, particularly the Hodl wave analysis, indicates Bitcoin may be approaching a local top, based on the historical precedent of long-term holders selling to short-term speculators at major price peaks.","The on-chain data suggests Bitcoin may be approaching a local top, as long-term holders sell to short-term speculators.",https://www.youtube.com/watch?v=VRkaOo6Garo,Youtube,Bitcoin On-Chain: HODL Waves,25938,2024-04-09 00:00:00,789,Benjamin Cowen
12,Benjamin Cowen,Bitcoin: The Beauty of Mathematics (Part 45),https://www.youtube.com/watch?v=qMIwh7UoPMo,"The transcript discusses the current state of the cryptocurrency market, particularly Bitcoin, and provides insights into the cyclical nature of its valuation. The speaker notes that the market has gone through periods of undervaluation and overvaluation, with the current situation being slightly overvalued. The speaker emphasizes the importance of recognizing these cycles and having a plan to scale in during undervaluation and scale out during overvaluation, as these phases can last for months or even years.

The transcript highlights the rotation of capital from altcoins to Bitcoin, with Bitcoin reaching new highs while many altcoins are still far from their previous highs. The speaker suggests that during the current late rate hiking cycle, it may be prudent to be ""heavy Bitcoin"" rather than heavily invested in riskier assets like Ethereum, as Bitcoin has historically outperformed during such periods. However, the speaker also notes that after rate cuts occur, the higher-risk assets may start to catch up.

The transcript provides a general market trend analysis, reminding viewers that the overall market trend is up over a long enough period, despite the presence of ""scary phases"" like March 2020, 2018, and 2014. The speaker suggests that focusing on the general market trend and Bitcoin dominance, as well as understanding the relationship between monetary policy and cryptocurrency performance, can help navigate these cycles.

The transcript concludes by noting that the ultimate goal for the cryptocurrency market is a market capitalization of over $10 trillion, with the speaker expressing a sense of wonder and optimism about the potential growth of the industry.

Overall, the transcript presents a bullish sentiment, emphasizing the cyclical nature of the cryptocurrency market and the importance of having a strategic approach to navigating these cycles, particularly in relation to Bitcoin's performance during different monetary policy environments.","The cryptocurrency market is cyclical, with periods of undervaluation and overvaluation. Bitcoin is currently slightly overvalued, but the overall trend is up, and the market has the potential to reach a $10 trillion market capitalization.",https://www.youtube.com/watch?v=qMIwh7UoPMo,Youtube,Bitcoin: The Beauty of Mathematics (Part 45),45927,2024-03-31 00:00:00,593,Benjamin Cowen
13,Benjamin Cowen,Jobs Report,https://www.youtube.com/watch?v=1TWdVGIKqu0,"The refined and more comprehensive summary is as follows:

1. The unemployment rate remained relatively flat at 3.7%, but some states like California and the District of Columbia have seen higher unemployment rates, potentially due to the impact of tightening on smaller tech companies.

2. The employment level, as measured by the establishment survey, showed a significant increase, with the private sector adding 317,000 jobs in the latest report, the largest monthly gain in a year, suggesting the economy is still creating jobs at a robust pace.

3. The strong jobs report makes it unlikely the Federal Reserve will cut interest rates in March, as some had speculated. The author argues that the Fed is likely to maintain its current restrictive stance until there is clear evidence of a significant economic slowdown.

4. The analysis also covers other employment metrics, such as job openings, which have started to level off but remain elevated, and the labor force participation rate, which has declined slightly on a year-over-year basis.

The additional context suggests that the longer the Fed maintains its restrictive stance, the more the higher market capitalization companies may outperform the lower market capitalization companies, as investors seek safer havens. This dynamic is driven by the stronger balance sheets and greater resilience of the larger firms compared to smaller businesses that may struggle to survive the tightening cycle. The author also discusses the potential timing of future interest rate cuts, noting that the market may be pricing in more cuts than the Fed is likely to deliver this year. However, the additional context does not provide any further insights to expand the existing summary.","The video concludes that the strong job market makes it unlikely the Fed will cut interest rates soon, as they maintain a restrictive stance to combat inflation.",https://www.youtube.com/watch?v=1TWdVGIKqu0,Youtube,Jobs Report,25937,2024-02-02 00:00:00,2531,Benjamin Cowen
14,Benjamin Cowen,Tesla Outlook,https://www.youtube.com/watch?v=COLLouRJIRY,"The refined and expanded summary is as follows:

The transcript provides a nuanced analysis of Tesla's stock performance and the author's evolving views on the company. Initially bullish on Tesla in 2017-2019, the author became increasingly cautious as the stock price skyrocketed, eventually turning very bearish in early 2022 as the broader market entered a bear market. The author predicted a potential 77% drop in Tesla's stock price, which ultimately materialized as a 75.5% decline.

The author acknowledges that their target was not exact and that being too focused on precise targets can be counterproductive. The author discusses the potential outcomes for Tesla going forward, suggesting that if a recession is avoided, the current low may hold, but if a recession occurs, Tesla could potentially test or even break below the recent low. The author notes that even in a recessionary environment, some stocks like Meta may only see a higher low, while Tesla could potentially drop 50% and reach the 77% drawdown target.

The additional context provides further insights into the author's thought process and approach. The author expresses a willingness to learn from their mistakes and not get caught up in ""dunking"" on others for having different views. The author also discusses the potential impact of interest rate changes and the Fed's actions on Tesla's demand and stock price, suggesting that a soft landing scenario could lead to the current low holding, while a hard landing could result in a test or breach of the recent low.

The overall sentiment is cautiously optimistic, with the author acknowledging the difficulty of predicting the exact market movements, but providing a balanced perspective on Tesla's potential future performance based on various economic scenarios. The author emphasizes the importance of maintaining an open and learning-oriented approach to investing.","Tesla's stock price declined 75.5%, in line with the author's cautious outlook amid broader market volatility.",https://www.youtube.com/watch?v=COLLouRJIRY,Youtube,Tesla Outlook,25660,2024-01-30 00:00:00,2199,Benjamin Cowen
15,Benjamin Cowen,Bitcoin: The Beauty of Mathematics (Part 42),https://www.youtube.com/watch?v=_Mk5E_GXKxw,"The refined and expanded summary is as follows:

The transcript provides a detailed analysis of the current state of the cryptocurrency market, particularly Bitcoin and the overall crypto asset class. The presenter discusses various metrics and models to assess the market's valuation, including the total market capitalization, the fair value logarithmic regression trend line, and the risk metric. The presenter argues that the crypto market has been in an undervaluation territory for the past year and a half, with the total market cap currently 24.65% below the fair value trend line.

The presenter presents two potential views on the current market cycle. The more bullish view suggests that the market is following a similar trajectory to previous cycles, with the potential for continued upside. The more bearish view, however, suggests that the market may be approaching a midcycle top, similar to what was observed in 2019, which could lead to a cooling-off period before a potential larger bull run. The presenter also discusses the potential impact of the Federal Reserve's interest rate decisions, noting that rate cuts could be a catalyst for a renewed bull market.

The presenter provides a detailed analysis of the total market capitalization of the crypto asset class, exploring the potential for the market to reach a $10 trillion valuation in the future. However, the presenter acknowledges the uncertainty and the potential for the Fed's actions to influence the market's trajectory.

The presenter also examines the Ethereum-Bitcoin valuation ratio, noting that it has been trading in a tight range, similar to the pattern observed in the previous cycle. The presenter suggests that the behavior of the Ethereum-Bitcoin ratio could provide insights into the current market cycle and the potential for a midcycle top, particularly in relation to the timing of potential interest rate cuts by the Federal Reserve.

Additionally, the presenter discusses the importance of social risk metrics, such as the level of social media engagement and sentiment, as potential indicators of the market's trajectory. The presenter suggests that a sustained increase in social risk could be a signal of a renewed bull market, but also acknowledges that the current level of engagement remains lower compared to the peak of the previous bull market.

Overall, the transcript presents a balanced and nuanced view of the current state of the cryptocurrency market, highlighting both the bullish and bearish factors that could shape the market's future performance, with a particular focus on the potential influence of monetary policy and the behavior of key market indicators.","The cryptocurrency market is in an undervalued state, with potential for a bullish or bearish cycle ahead, depending on Federal Reserve policies.",https://www.youtube.com/watch?v=_Mk5E_GXKxw,Youtube,Bitcoin: The Beauty of Mathematics (Part 42),59217,2024-01-01 00:00:00,2496,Benjamin Cowen
16,Benjamin Cowen,Bitcoin On-Chain Risk,https://www.youtube.com/watch?v=XJiAyLtFO6I,"The video transcript discusses the concept of on-chain risk analysis, which is a method of evaluating the risk in the cryptocurrency market based on various on-chain metrics. The speaker explains that on-chain analysis can sometimes be used to paint a more optimistic picture of the market, but it can also provide valuable insights into the overall risk level.

The speaker outlines several on-chain risk metrics, including the MVRV Z-score, P/E multiple, MVRV risk, miner cap to thermocap ratio, transaction fees risk, market cap to thermocap ratio, terminal price risk, HODL ratio, and supply and profit risk. Each of these metrics is normalized on a scale of 0 to 1, with higher values indicating higher risk.

The speaker then combines these individual risk metrics into a single ""total on-chain risk"" score, which is currently at 0.55. The speaker suggests that when the total on-chain risk is low (between 0 and 0.4), it may be a good time to buy, and when it is high (above 0.6), it may be a good time to sell. However, the speaker also acknowledges that the on-chain risk does not always accurately predict market movements, and that it is important to consider other factors as well.

The speaker emphasizes that their personal investment strategy is to simply react to the on-chain risk levels, rather than trying to predict market movements based on their own biases or opinions. They argue that this approach allows them to sleep well at night, as they are not constantly trying to guess what the market will do.

Overall, the transcript presents a bullish sentiment towards the use of on-chain risk analysis as a tool for navigating the cryptocurrency market, while also acknowledging its limitations and the importance of a disciplined, reactive investment strategy.

The main message and conclusion of the transcript is that on-chain risk analysis can provide valuable insights into the overall risk level in the cryptocurrency market, and that a disciplined, reactive investment strategy based on these risk levels can be an effective way to navigate the market.","On-chain risk analysis can provide valuable insights into cryptocurrency market risk, but should be used with other factors.",https://www.youtube.com/watch?v=XJiAyLtFO6I,Youtube,Bitcoin On-Chain Risk,30560,2023-12-21 00:00:00,432,Benjamin Cowen
