,Channel_name,Video_title,Video_url,Detailed_Summary,One_Line_Summary,Video_Source,Video_Type,Video_Title,View_Count,Publish_Date,Video_Length,Author
17,Benjamin Cowen,Bitcoin: Percentage Drawdown From All Time Highs,https://www.youtube.com/watch?v=CzF7lQbQAmg,"The video transcript discusses the percentage drawdown of Bitcoin from its all-time high, providing a detailed analysis of the cryptocurrency's price movements across different market cycles. The presenter notes that in the previous two cycles, Bitcoin experienced significant drawdowns of around 93% and 82-87% respectively, before recovering. In the current cycle, the drawdown has been around 75%, with a brief spike to around 38% down from the highs, similar to the patterns observed in the previous cycles.

The presenter suggests that this spike in the drawdown percentage could be an indication of a potential ""cool-off period"" in the coming months, similar to what was observed in the previous cycles. The presenter also compares the drawdown of Bitcoin to that of Ethereum, which has seen a larger drawdown of around 54% from its all-time high, indicating that Bitcoin has been holding up better than Ethereum during the current market conditions.

The presenter also discusses the potential impact of the upcoming spot Bitcoin ETF, which could be launched in January, and how it might affect the market dynamics and lead to a similar rally and subsequent cool-off period as observed in the past.

The overall sentiment of the transcript is cautiously optimistic, as the presenter is analyzing the historical patterns and drawing parallels to the current market conditions, without making any definitive predictions. The presenter is encouraging viewers to closely monitor the market developments and the percentage drawdown from the all-time highs, as it could provide valuable insights into the future price movements of Bitcoin.

In summary, the main message of the transcript is a detailed analysis of the percentage drawdown of Bitcoin from its all-time high, with a focus on the historical patterns and the potential implications of the upcoming spot Bitcoin ETF.","Bitcoin's drawdowns have historically shown a pattern of significant drops followed by recoveries, with the current cycle showing a 75% drawdown, similar to past cycles.",https://www.youtube.com/watch?v=CzF7lQbQAmg,Youtube,Bitcoin: Percentage Drawdown From All Time Highs,31672,2023-12-16 00:00:00,356,Benjamin Cowen
18,Benjamin Cowen,Bitcoin Dominance,https://www.youtube.com/watch?v=1zR6R6DC_Zo,"The refined and expanded summary is as follows:

The video transcript discusses the importance of Bitcoin dominance in the cryptocurrency market. The speaker argues that Bitcoin dominance is a key metric to follow, as it can provide insights into the performance of the overall altcoin market. The speaker maintains that during the current stage of the market cycle, the Bitcoin dominance is likely to increase, to the detriment of the altcoin market.

This view is based on the speaker's observation that the altcoin market has generally underperformed Bitcoin over the past 18 months, with many altcoins losing significant value against Bitcoin. The speaker provides historical examples to support this, showing how the altcoin market has tended to bleed against Bitcoin during periods when the Bitcoin dominance has risen. The speaker argues that this rotation of capital from altcoins to Bitcoin is a rational strategy, as it allows investors to maximize their risk-adjusted returns.

The additional context further reinforces the speaker's bearish sentiment on the altcoin market. The speaker contends that most altcoins have continued to lose value against Bitcoin, even as Bitcoin has reached new highs. This is exemplified by the performance of altcoins like Cardano, Polkadot, and Avalanche, which have seen significant declines against their Bitcoin pairs despite Bitcoin's recent rally.

The speaker suggests that the altcoin market may need to drop another 50% against Bitcoin, as the liquidity continues to flow from altcoins to Bitcoin. This is supported by the speaker's analysis of the Bitcoin dominance, which has been putting in higher lows since 2018, even when including stablecoins in the calculation.

The speaker provides further historical context, highlighting how the altcoin market has typically underperformed Bitcoin during the pre-halving year, with both bulls and bears getting ""sufficiently wrecked"" on the altcoin market. The speaker argues that this pattern is likely to repeat, with the altcoin market continuing to bleed against Bitcoin.

The overall sentiment of the transcript remains bearish on the altcoin market, with the speaker advising that the collective altcoin market is not worth the risk compared to Bitcoin. The main message and conclusion of the transcript is that the Bitcoin dominance is likely to continue rising, and that investors should focus on Bitcoin as a lower-risk option compared to altcoins.","Bitcoin dominance is likely to increase, leading to underperformance of the altcoin market.",https://www.youtube.com/watch?v=1zR6R6DC_Zo,Youtube,Bitcoin Dominance,49188,2023-06-27 00:00:00,3187,Benjamin Cowen
19,Benjamin Cowen,S&amp;P 500 ROI After Yield Curve Inversion,https://www.youtube.com/watch?v=0ZljXuhkPSw,"The transcript discusses the relationship between yield curve inversions and the performance of the S&P 500 index. It highlights that yield curve inversions, where shorter-term Treasury yields exceed longer-term yields, have historically been a reliable indicator of impending recessions, though the time between inversion and the onset of a recession can vary significantly, sometimes taking over a year.

The video analyzes the current yield curve inversion, which began in late 2022, and compares the S&P 500's performance during this period to previous instances of yield curve inversions. Notably, the S&P 500 has outperformed historical averages, continuing to climb the ""wall of worry"" despite the inverted yield curve. The presenter acknowledges that this resilience is unprecedented and has exceeded their own expectations.

However, the video cautions that the market's ability to defy the historical patterns associated with yield curve inversions is not guaranteed to continue indefinitely. It emphasizes that the eventual resolution of the yield curve inversion, whether through a recession or otherwise, is inevitable, though the timing remains highly uncertain.

The transcript provides a detailed analysis of the performance of the S&P 500 and the Russell 2000 index following past yield curve inversions, highlighting the potential for further market rallies before an eventual downturn. The overall sentiment is cautiously bullish, acknowledging the market's ability to surprise but also recognizing the historical significance of yield curve inversions and the need to be prepared for the eventual resolution of the current inversion.

In summary, the main message of the transcript is that while the current market rally has defied historical patterns associated with yield curve inversions, the eventual resolution of the inversion remains a significant risk factor that investors should closely monitor, as it could lead to a market downturn, even if the timing is uncertain.","Yield curve inversion signals recession, but current S&P 500 rally defies history.",https://www.youtube.com/watch?v=0ZljXuhkPSw,Youtube,S&P 500 ROI After Yield Curve Inversion,27118,2023-06-21 00:00:00,941,Benjamin Cowen
20,Benjamin Cowen,No Shill Zone (With Ben Cowen and Gareth Soloway),https://www.youtube.com/watch?v=38aMSriDEVM,"The refined and expanded summary is as follows:

The transcript discusses the current state of the cryptocurrency market, with a focus on Bitcoin dominance and its potential impact on altcoins. The speaker, Ben Cowan, believes that Bitcoin dominance is likely to continue increasing, potentially reaching around 60% by September or October. He suggests that this is due to the regulatory risks and idiosyncratic risks associated with altcoins, which are causing investors to shift towards the relative safety of Bitcoin.

Cowan also discusses the historical patterns of Bitcoin dominance, noting that in previous cycles, the dominance rally has been accompanied by a period of Bitcoin price appreciation, followed by a period of Bitcoin price decline. He suggests that we may be in a similar phase currently, where Bitcoin is propping up the overall cryptocurrency market, but there is still a risk of Bitcoin putting in a new low.

Regarding the broader market sentiment, Cowan and the host, Gareth, discuss the potential for a ""soft landing"" in the stock market, with the host acknowledging that he has been on the bearish side recently, but the markets have continued to rally. Cowan suggests that there are cracks emerging in the economy, such as rising initial jobless claims, increasing credit card delinquency rates, and elevated bankruptcy levels, which could lead to a more substantial market downturn.

The additional context provided further expands on the economic indicators and potential risks facing the broader financial markets. Cowan and Gareth discuss the historical patterns of market cycles, noting that even during previous recessions, there have been periods of market rallies before the eventual downturn. They suggest that the current market rally may be a similar ""melt-up"" phase before a more significant correction, and that the path to a ""hard landing"" often goes through a perceived ""soft landing"" scenario.

The speakers also touch on the real estate market, with Cowan highlighting the challenges facing the commercial real estate sector, as well as the potential risks in the residential real estate market due to rising interest rates and affordability concerns. They suggest that the real estate market could be in the early stages of a downturn, with potential for a more significant correction in the coming years.

Regarding the bond market, Cowan and Gareth discuss the inverted yield curve, which has historically been a precursor to recessions. They note that the current inversion is more significant than in previous periods, and that it could signal a recession before the yield curve uninverts. However, they also acknowledge that the relationship between the yield curve and recessions is not always straightforward, and that the current high-inflation environment may lead to a recession before the yield curve uninverts.

The overall sentiment of the transcript remains cautiously bearish, with the speakers highlighting the risks and potential challenges facing the cryptocurrency, real estate, and broader financial markets. The main message and conclusion is that Bitcoin dominance is likely to continue increasing, potentially at the expense of altcoins, and that there are signs of economic weakness that could lead to a more significant market correction, potentially similar to past recessionary periods.","The main message of the video is that Bitcoin dominance is likely to continue increasing, posing risks for altcoins, while economic indicators suggest a potential market downturn ahead.",https://www.youtube.com/watch?v=38aMSriDEVM,Youtube,No Shill Zone (With Ben Cowen and Gareth Soloway),51108,2023-06-19 00:00:00,3182,Benjamin Cowen
21,Benjamin Cowen,Ethereum Logarithmic Regression,https://www.youtube.com/watch?v=SnxRsYt5h7M,"The transcript provides a detailed analysis of Ethereum's price performance, focusing on its valuation relative to Bitcoin and its logarithmic regression trend line. The speaker argues that tracking Ethereum's performance against Bitcoin is a more important metric than its USD valuation, as it provides better insights into the cryptocurrency's market dynamics.

The speaker discusses the concept of fitting a logarithmic regression band to Ethereum's price data, excluding what is considered ""bubble"" data. They suggest that the fair value of Ethereum, according to this regression model, is around $875, which is close to the prior low of $880. The speaker also mentions a potential ""worst-case scenario"" where Ethereum could drop to around $400, based on the regression band's historical deviations.

The transcript also examines Ethereum's performance during pre-halving years, noting that it tends to rally for the first half of the year and then fade in the second half. The speaker suggests that Ethereum could potentially close the year below its yearly open of $1,195, which would represent a significant drop from the current price of around $1,700.

The speaker presents two logarithmic regression charts, the ""fair value"" regression line and the ""logarithmic regression rainbow,"" both of which suggest that Ethereum may revisit its lower regression trend line in the near future. The speaker argues that this is likely due to Ethereum's Bitcoin valuation being in a downtrend, with lower highs being put in since mid-April.

Overall, the transcript adopts a bearish sentiment, suggesting that Ethereum is likely to fade in the second half of the year and potentially revisit its fair value regression line or even lower levels. The speaker's main message is that tracking Ethereum's performance against Bitcoin is the most important metric, and that the cryptocurrency's USD valuation is likely to decline in the coming months.",Ethereum's price analysis suggests it may decline towards $400-$875 range based on regression models and Bitcoin valuation.,https://www.youtube.com/watch?v=SnxRsYt5h7M,Youtube,Ethereum Logarithmic Regression,44412,2023-06-18 00:00:00,756,Benjamin Cowen
22,Benjamin Cowen,Cardano Outlook,https://www.youtube.com/watch?v=znrZR9sp6uY,"The video transcript discusses the current state of the cryptocurrency market, particularly focusing on the performance of Cardano's native token, ADA. The presenter highlights that ADA has been experiencing a prolonged period of decline, with the token reaching new lows even as Bitcoin has not yet reached its previous low. This is presented as evidence that altcoins can continue to bleed for much longer than expected, even during a bear market or pre-halving year for Bitcoin.

The presenter provides a detailed analysis of ADA's performance against Bitcoin, noting that the ADA/BTC valuation has fallen to around 1,000 satoshis, a level last seen four years ago. The presenter suggests that the ADA/BTC valuation could potentially drop further, potentially reaching 400 satoshis, based on the historical patterns observed in the previous market cycle. This view is supported by the presenter's observation that the Bitcoin dominance has broken out of its previous range, which typically signals a prolonged period of altcoin underperformance.

The presenter also discusses the ADA/ETH valuation, which appears to be in a downward trend, and suggests that this is another factor to consider when evaluating the overall performance of ADA. The presenter cautions that while ADA may experience a bounce on its USD valuation if Bitcoin rallies, the risk-adjusted returns may not be as attractive as simply holding Bitcoin during this phase of the market cycle.

Overall, the sentiment of the transcript is bearish on the short-term prospects of ADA, with the presenter advising viewers to focus primarily on Bitcoin and maintain a good cash position, rather than rushing to invest in altcoins. The main message and conclusion of the transcript is that the altcoin market, including ADA, is likely to continue bleeding against Bitcoin for an extended period, and that patience and a cautious approach are warranted in the current market environment.","The video suggests that Cardano's ADA token will likely continue to underperform Bitcoin in the near-term, as altcoins typically bleed during a Bitcoin bear market or pre-halving period.",https://www.youtube.com/watch?v=znrZR9sp6uY,Youtube,Cardano Outlook,78193,2023-06-17 00:00:00,839,Benjamin Cowen
23,Benjamin Cowen,ETH/BTC Outlook,https://www.youtube.com/watch?v=CkhF4Aop4kM,"The refined and expanded summary is as follows:

The transcript presents a bearish outlook on the Ethereum-Bitcoin (ETH/BTC) valuation, arguing that it is likely to continue declining in the near future. The speaker provides several pieces of evidence to support this view:

1. The ETH/BTC ratio has been putting in a series of lower highs since late 2021, despite the Ethereum network's transition to a proof-of-stake consensus mechanism (the ""merge""). This suggests the merge did not have a significant positive impact on the ETH/BTC valuation.

2. The Bitcoin dominance has broken out of its previous trading range, indicating that Bitcoin is likely to outperform altcoins, including Ethereum, as the market transitions to a period of quantitative tightening and higher interest rates.

3. Technical analysis of the ETH/BTC chart shows it has been unable to sustain a move above the bull market support band (20-week SMA and 21-week EMA), and the 20-month SMA has been acting as resistance, suggesting further downside.

4. The ETH/BTC ratio exhibits a distribution pattern similar to Bitcoin's in early 2021, which was followed by a significant correction, implying the ETH/BTC ratio could experience a similar fate.

5. Seasonality analysis indicates that the ETH/BTC ratio tends to underperform during the latter half of the year, particularly from June onwards, which is the pre-halving period.

6. Historical data shows that when Bitcoin breaks below its 20-week moving average, the ETH/BTC ratio has consistently underperformed Bitcoin until Bitcoin breaks back above the 20-week MA. This pattern has held true 9 out of 9 times, with the exception of the pre-halving year of 2019, when Bitcoin outperformed Ethereum.

The additional context provided further reinforces the speaker's bearish stance on the ETH/BTC ratio. The speaker argues that the pre-halving year is typically a period where Bitcoin tends to outperform Ethereum, and the current market conditions suggest the ETH/BTC ratio is likely to experience a significant decline, potentially reaching the 0.03-0.04 range before a potential reassessment. The overall sentiment of the transcript remains strongly bearish, with the speaker presenting a comprehensive case for the ETH/BTC ratio to collapse as the market transitions to a period of tighter monetary conditions, with Bitcoin expected to outperform Ethereum.","The video presents a bearish outlook on the Ethereum-Bitcoin (ETH/BTC) valuation, predicting its decline due to Bitcoin's outperformance during the pre-halving period and tighter monetary conditions.",https://www.youtube.com/watch?v=CkhF4Aop4kM,Youtube,ETH/BTC Outlook,44657,2023-06-13 00:00:00,1765,Benjamin Cowen
24,Benjamin Cowen,The Altcoin Reckoning,https://www.youtube.com/watch?v=2C6cPfSoZTQ,"The refined and expanded summary is as follows:

The transcript presents a strongly bearish outlook on the altcoin market, emphasizing the ""altcoin Reckoning"" - a systematic bleeding of altcoins against both Bitcoin and Ethereum. The speaker argues that as long as Bitcoin's dominance remains below 49%, the altcoin market is in a holding pattern, with liquidity flowing from altcoins to Bitcoin and Ethereum.

The speaker claims that the upside target for the altcoin market this year is the low 400 billion dollar range, and that meme coins do not lead to real adoption, but rather exist to suck in liquidity. The speaker advises against ""marrying"" altcoins, as most are likely to go to zero, and suggests focusing on Bitcoin and Ethereum as the cryptocurrencies that will stand the test of time.

The speaker provides numerous examples to illustrate the systematic bleeding of altcoins against Bitcoin and Ethereum. Coins like Cardano (ADA), Polkadot (DOT), Chainlink (LINK), and Avalanche (AVAX) have all seen significant declines of 80% or more against their Bitcoin and Ethereum pairs. The speaker warns that this pattern can repeat, with altcoins potentially losing another 80% of their value, as seen in previous market cycles.

The speaker emphasizes that the altcoin Reckoning is not over, and that the collapse of the Ethereum-Bitcoin valuation is likely the event that will mark the end of this bearish phase. Until then, the speaker advises focusing on the ""blue chip"" cryptocurrencies of Bitcoin and Ethereum, as the altcoin market continues to bleed liquidity.

The additional context further reinforces the speaker's bearish stance on the altcoin market. The speaker provides more specific examples of altcoins, such as Algorand, that have already reached new lows, and suggests that the overall altcoin market could see a further 39% drop from current levels, potentially reaching a low of around 200 billion dollars. The speaker also notes that the stablecoin market, which is a significant component of the overall crypto market, is also showing signs of weakness, with the total stablecoin market capitalization declining.

The overall sentiment remains strongly bearish on the altcoin market, with the speaker repeatedly emphasizing the ""altcoin Reckoning"" and the systematic bleeding of altcoins against both Bitcoin and Ethereum. The main message and conclusion is that the best strategy is to focus on the more established cryptocurrencies like Bitcoin and Ethereum, rather than speculating on altcoins or meme coins, as the altcoin market is likely to continue its bearish trend.","The video presents a bearish outlook on the altcoin market, advising to focus on Bitcoin and Ethereum.",https://www.youtube.com/watch?v=2C6cPfSoZTQ,Youtube,The Altcoin Reckoning,67382,2023-06-09 00:00:00,3003,Benjamin Cowen
25,Benjamin Cowen,Real Estate Outlook,https://www.youtube.com/watch?v=-kpGCbbkO24,"The refined and expanded summary is as follows:

The transcript provides a detailed analysis of the current state of the real estate market in the United States, covering various metrics and indicators. The presenter acknowledges his limited expertise in the real estate sector but proceeds to systematically review several key charts and data points.

The analysis covers the purchase-only house price index, which shows that the real estate market has generally trended upwards over time, with the exception of the 2007-2011 downturn. The presenter notes that the real estate market can be resilient to crashes in the stock market, but argues that the reverse is not true - a significant downturn in real estate is likely to have a negative impact on the equity markets.

The transcript examines the Zillow home value index, mortgage rates, delinquency rates, and the demand for real estate loans, all of which suggest a slowdown in the real estate market, particularly in the latter half of 2022. The presenter highlights the potential impact of higher interest rates, which have made it more difficult for buyers to afford homes, leading to a drop in demand.

However, the analysis also points to some positive signs, such as the recent increase in new single-family home sales and the decline in the new houses for sale-to-sold ratio. The presenter acknowledges the seasonal nature of the real estate market and suggests that the current trends may not necessarily lead to a major crash in the equity markets.

The additional context provides further insights into the real estate market. The presenter notes that the amount of time it takes to sell a new home has been increasing, indicating a tightening of the market, despite still relatively low inventory levels. Housing starts and housing units under construction have also been trending downward, which can be a concerning sign for the broader economy, as these metrics have historically corresponded with recessions.

The presenter also examines the home ownership rate, which has been slowly increasing, despite the perception of many people feeling priced out of the market. Additionally, the owner's equity level in real estate has been declining, but the rate of decline has been slowing, suggesting the market may be stabilizing.

The rental vacancy rate has also been increasing, which is not a positive sign for the real estate market. Finally, the presenter looks at furniture and home furnishing sales, a cyclical metric, which has shown some signs of slowing down but not yet entered a sustained period of contraction.

Overall, the transcript presents a balanced and nuanced view of the real estate market, acknowledging both the challenges and the potential resilience of the sector. The presenter refrains from making definitive predictions, but highlights the key factors that are shaping the current real estate landscape.","The real estate market is showing signs of a slowdown, with higher interest rates and softening demand, but the overall picture remains mixed.",https://www.youtube.com/watch?v=-kpGCbbkO24,Youtube,Real Estate Outlook,25329,2023-06-08 00:00:00,1756,Benjamin Cowen
