,Channel_name,Video_title,Video_url,Detailed_Summary,One_Line_Summary,Video_Source,Video_Type,Video_Title,View_Count,Publish_Date,Video_Length,Author
0,Benjamin Cowen,Bitcoin Dominance,https://www.youtube.com/watch?v=OrEdDZ94Od0,"The refined and expanded summary is as follows:

The video transcript presents a bullish case for Bitcoin dominance, arguing that it will continue to rise as the Federal Reserve maintains a tight monetary policy, leading to the altcoin market bleeding to the relative safety of Bitcoin. The speaker has been bullish on Bitcoin dominance for the past 2.5 years, and notes that it has recently hit a new cycle high of 57%, contrary to the expectations of many who believed it had already topped out.

The speaker attributes this to the fact that Bitcoin dominance tends to top out after the Federal Reserve starts cutting interest rates, rather than just based on the typical 4-year market cycle. The speaker suggests that Bitcoin dominance could continue to rise towards a 60% target, as the Federal Reserve keeps pushing back the timeline for interest rate cuts, which are seen as necessary for the altcoin market to start outperforming Bitcoin.

The speaker acknowledges that this process may not be linear, and there could be pullbacks and volatility along the way. The speaker emphasizes that the decision to invest in Bitcoin versus altcoins should be based on a risk-adjusted analysis, as Bitcoin is considered the least risky asset in the cryptocurrency space.

The speaker also discusses the potential for a short-term bounce in Ethereum's price relative to Bitcoin (ETH/BTC), but suggests that any such bounce would likely be rejected at the bull market support band and ultimately lead to further downside. The speaker's base case is for ETH/BTC to bottom out in June or July, potentially coinciding with the timing of the next Federal Reserve rate cut.

Additionally, the speaker provides historical analysis on the seasonal trends in Ethereum's and Bitcoin's performance, noting that altcoins tend to underperform Bitcoin during the summer months. The speaker also examines the relationship between Bitcoin dominance and the cryptocurrency market's performance around Bitcoin halving events, suggesting that Bitcoin dominance could see a spike in the third quarter of the year, similar to what has been observed in previous halving cycles.

The speaker further elaborates on the potential for altcoin capitulation, noting that many altcoins have been in a macro downtrend, exhibiting lower highs and lower lows against Bitcoin. The speaker suggests that this process may not be linear, and there could be short-term bounces and volatility along the way, but the overall trend is for altcoins to bleed against Bitcoin.

The speaker also discusses the potential for specific altcoins, such as Cardano (ADA) and Solana (SOL), to see further downside against Bitcoin. The speaker cautions against relying too heavily on trend lines, as they can sometimes be broken, and emphasizes the importance of a risk-adjusted approach when investing in the cryptocurrency market.

The additional context provided in the transcript does not offer any significant new information to further expand the summary. The existing summary already covers the key points and insights presented in the video transcript.","Bitcoin dominance to rise as the Federal Reserve maintains tight monetary policy, leading altcoins to bleed.",https://www.youtube.com/watch?v=OrEdDZ94Od0,Youtube,Bitcoin Dominance,30113,2024-04-21 00:00:00,5903,Benjamin Cowen
1,Benjamin Cowen,The 2024 Bitcoin Halving (LIVE!),https://www.youtube.com/watch?v=fAuXfvZ5W9o,"The enhanced and more comprehensive summary is as follows:

The transcript discusses the upcoming 2024 Bitcoin halving event, the fourth such event in Bitcoin's history. The speaker analyzes the current market conditions, noting the recent downturn in the broader markets, including the S&P 500 and Nasdaq. He suggests that the post-halving period could see a potential ""dump"" in Bitcoin's price, similar to what occurred after the 2016 halving.

The speaker believes that altcoins are still in the midst of their ""altcoin reckoning,"" with their Bitcoin pairs continuing to set new lows. He expects this summer to be a ""somewhat boring"" period where altcoin Bitcoin pairs finally bottom out. The speaker predicts that Bitcoin dominance will rise to around 60% before Bitcoin's price eventually falls below its 20-week moving average, at which point the market will have to determine the extent of the damage caused by the Federal Reserve's rate hike cycle.

The speaker provides a detailed technical analysis, outlining potential milestones such as Ethereum's Bitcoin pair reaching 0.03-0.04, and Bitcoin's price potentially correcting back to 60% below its all-time high, which would still be in line with previous market cycles. He emphasizes that this period of Bitcoin dominance increasing and altcoins underperforming is a necessary precursor to the next ""altcoin season.""

The speaker also discusses the potential for the Federal Reserve to cut interest rates earlier than expected, potentially as soon as June or July, if the labor market shows signs of weakness. He believes the Fed will be quick to pivot if the unemployment rate spikes, as it did in June 2022. The speaker suggests that the pricing out of rate cuts could lead to them being priced back in, as the market realizes the Fed may need to act more aggressively to support the economy.

Additionally, the speaker provides insights on altcoin selection, advising investors to look for altcoins that can establish a bottom against Bitcoin over the next 3-6 months, as these are more likely to be the ones that will perform well in the next ""altcoin season.""

The speaker also discusses the importance of timing and risk bands when it comes to dollar-cost averaging (DCA) strategies. He suggests that by DCAing at lower risk levels, investors can potentially double or triple their returns compared to a static DCA approach.

Overall, the transcript presents a bearish short-term outlook for the cryptocurrency market, with the speaker anticipating further downside for altcoins on their Bitcoin pairs before the market can recover. The main message is that the current market cycle is following a familiar pattern, and investors should be prepared for a potentially volatile and choppy period ahead of the next major uptrend.","The video discusses the upcoming 2024 Bitcoin halving, market conditions, and the potential for altcoin recovery and the next ""altcoin season"".",https://www.youtube.com/watch?v=fAuXfvZ5W9o,Youtube,The 2024 Bitcoin Halving (LIVE!),81555,2024-04-19 00:00:00,3901,Benjamin Cowen
2,Benjamin Cowen,Bitcoin: The Halving Approaches,https://www.youtube.com/watch?v=QhJFtaXaYxE,"The transcript discusses the upcoming Bitcoin halving event, which is a significant event in the cryptocurrency market where the block reward for mining Bitcoin is reduced by half. The speaker provides an analysis of the potential short-term outcomes for Bitcoin's price action following the halving, suggesting two likely scenarios: either Bitcoin goes straight to its 20-week simple moving average (SMA) or it experiences a bounce to just above the 8-week moving average before resolving to a lower low in May.

The speaker compares Bitcoin's current price action to previous market cycles, noting that the S&P 500 and Ethereum have already reached their respective 20-week SMAs, indicating that Bitcoin could potentially follow suit. However, the speaker acknowledges the uncertainty in predicting the exact outcome and suggests that the market will likely provide more clarity in the coming weeks.

The speaker also discusses the potential impact of the halving on the altcoin market, suggesting that if Bitcoin were to drop to its 20-week SMA, it could lead to altcoins falling below their bull market support bands, similar to what was observed in 2019. The speaker emphasizes that the altcoin market is highly sensitive to Bitcoin's price movements, and a prolonged period of Bitcoin consolidation or choppiness could result in a significant devaluation of altcoin Bitcoin pairs.

The speaker expresses a bullish long-term outlook on Bitcoin, stating that it is ""ahead of schedule"" compared to previous cycles and can afford to give back some of its gains while still remaining in line with historical trends. However, the speaker cautions that the altcoin market may be more vulnerable to further downside, as many altcoins are not far from their lows and could potentially set new lows if Bitcoin retraces to levels seen in previous cycles.

Overall, the transcript presents a cautious and analytical perspective on the potential market dynamics surrounding the Bitcoin halving, with a focus on the potential implications for both Bitcoin and the broader altcoin market.","The video discusses the upcoming Bitcoin halving, analyzing potential short-term price scenarios and the impact on the altcoin market.",https://www.youtube.com/watch?v=QhJFtaXaYxE,Youtube,Bitcoin: The Halving Approaches,32859,2024-04-19 00:00:00,1110,Benjamin Cowen
3,Benjamin Cowen,Bitcoin Halving Eve,https://www.youtube.com/watch?v=kjHe5KLT1W8,"The refined and expanded summary is as follows:

The transcript discusses the upcoming Bitcoin halving event, which is set to occur in around 24 hours. The host expresses uncertainty about the market's reaction, noting that there could be significant volatility around the event. He suggests that the altcoin market may suffer if Bitcoin either rallies or drops significantly, as altcoins tend to bleed against Bitcoin during such periods.

The host also discusses Bitcoin dominance, stating that he has been bullish on it for over 2.5 years and believes it could reach 60% this summer. He cautions viewers to be prepared for this, as it would likely be detrimental to the altcoin market. The host notes that the demographics of his audience are predominantly male, between the ages of 25-44, and mostly from the United States, UK, Australia, Canada, and the Netherlands.

Regarding the current market conditions, the host acknowledges that Bitcoin is trading just below $61,000 and that gold has broken out, which he sees as a risk-off signal for the crypto market. He suggests that the altcoin market has been struggling, with many altcoins hitting new lows against Bitcoin. The host believes that this is similar to what was observed before the previous rate cuts, where altcoins struggled as Bitcoin either rallied or dropped.

The host also discusses the potential for the Federal Reserve to cut interest rates, stating that he believes they may do so sooner than the market currently expects, as the pricing out of rate cuts could cause them to be priced back in. He suggests that businesses may change their spending behavior if they believe the Fed will keep rates higher for longer, which could ultimately lead to the Fed cutting rates sooner.

The additional context provides further insights into the host's perspective on the current market dynamics. He emphasizes that altcoins tend to bleed against Bitcoin during periods of volatility, and that Bitcoin dominance is likely to continue rising, potentially reaching 60% this summer. The host cautions that this would be detrimental to the altcoin market, as the lack of new retail investors entering the space would lead to the altcoin market continuing to struggle against Bitcoin.

The host also discusses the potential impact of the Federal Reserve's interest rate decisions, suggesting that the pricing out of rate cuts could lead to them being priced back in sooner than expected. He believes that this could cause businesses to change their spending behavior, ultimately leading the Fed to cut rates sooner than the market currently anticipates.

Overall, the transcript maintains a cautious and somewhat bearish tone, with the host expressing concerns about the potential impact of the Bitcoin halving and the current market conditions on the altcoin market. He emphasizes the importance of having a plan to navigate the upcoming volatility and suggests that Bitcoin dominance may continue to rise, potentially to the detriment of altcoins.","The video discusses the upcoming Bitcoin halving, market volatility, Bitcoin dominance, and the potential impact of Federal Reserve interest rate decisions on the crypto market, with a cautious and bearish outlook.",https://www.youtube.com/watch?v=kjHe5KLT1W8,Youtube,Bitcoin Halving Eve,57511,2024-04-18 00:00:00,5221,Benjamin Cowen
4,Benjamin Cowen,NFA Live! The Bitcoin Halving,https://www.youtube.com/watch?v=wS-ramvvRFU,"The refined and expanded summary is as follows:

The transcript discusses the upcoming Bitcoin halving event and its potential impact on the cryptocurrency market. The speakers, Rob and Max, share their views on how Bitcoin has historically performed in the year leading up to and following a halving event. They note that while there are often dips before the halving, the year after has typically seen significant price appreciation, with past halvings resulting in 500-600% gains.

The discussion also touches on Bitcoin dominance, with Max suggesting that the recent surge in Bitcoin dominance may be nearing a peak, drawing parallels to a similar pattern seen in 2020. He believes that over the next 6 months, Bitcoin dominance could trend downwards, potentially leading to a bottom in the ETH/BTC ratio.

The speakers acknowledge the role of macroeconomic factors, such as Federal Reserve policy and potential quantitative easing, in shaping the cryptocurrency market's performance. They express cautious optimism about the market's prospects, recognizing that while the current environment is unique, historical patterns and cycles suggest potential for further upside in the short to medium term.

The discussion also covers the potential for growth in Layer 2 solutions built on Bitcoin, such as Stacks and Core, which offer cheaper and faster transactions compared to Ethereum. The speakers suggest that the development of these Layer 2 solutions could contribute to an increase in Bitcoin dominance, as they provide more functionality and utility for the Bitcoin network.

Additionally, the speakers touch on the concept of ""sell in May and go away,"" a seasonal trading strategy that has historically shown some success in the cryptocurrency market. They analyze past performance during presidential election years and non-election years, noting that the market tends to experience more volatility and potential downside during election years.

The overall sentiment of the transcript is bullish, with the speakers highlighting the positive historical precedents and the potential for continued growth in the cryptocurrency market, particularly around the Bitcoin halving event. The main message is that while there may be some near-term volatility, the long-term outlook for Bitcoin and the broader cryptocurrency space remains favorable, with the development of Layer 2 solutions and the potential for increased Bitcoin dominance as key factors to consider.","The main message is that the upcoming Bitcoin halving event could lead to significant price appreciation in the cryptocurrency market, based on historical patterns and cycles.",https://www.youtube.com/watch?v=wS-ramvvRFU,Youtube,NFA Live! The Bitcoin Halving,39682,2024-04-18 00:00:00,3967,Benjamin Cowen
5,Benjamin Cowen,Bitcoin: Dubious Speculation,https://www.youtube.com/watch?v=AwqI3fDVbp8,"The refined and expanded summary is as follows:

The video transcript provides a comprehensive analysis of the current state of the cryptocurrency market, particularly Bitcoin, and potential scenarios going forward. The key points are:

1. The video examines the behavior of the 8-week exponential moving average (8WE SMA) and its significance as a support level for Bitcoin. The presenter notes that a weekly close below this level would be a significant milestone and discusses past instances where Bitcoin has reacted after falling below the 8WE SMA.

2. The presenter compares the current Bitcoin rally to previous rallies in 2019 and 2021, highlighting similarities in the market dynamics. He suggests that the market's reaction to a potential weekly close below the 8WE SMA could be similar to what was observed in 2019, where Bitcoin had a relief rally but Ethereum's performance (measured by the ETH/BTC pair) continued to decline.

3. The analysis suggests that the current market environment, characterized by the Federal Reserve's quantitative tightening, is different from the 2021 scenario, where the Fed was expanding its balance sheet. This difference in monetary policy is expected to have an impact on the performance of the ETH/BTC pair, potentially leading to a decline rather than a rally.

4. The presenter acknowledges that there is no guarantee of a relief rally, and even if one occurs, it does not necessarily mean that altcoins will benefit. He cites examples from 2019 where Bitcoin rallies did not translate into gains for altcoins, as Bitcoin's strength continued to weigh on the altcoin market.

5. The overall sentiment of the transcript is cautious and bearish, as the presenter suggests that the current market conditions, particularly the Federal Reserve's monetary policy, are not favorable for altcoins and that Bitcoin dominance is likely to continue increasing.

6. The presenter provides additional insights and analysis, including the potential for a ""summer lull"" in the cryptocurrency market, similar to what was observed in 2019 and 2021. He examines various indicators, such as Bitcoin dominance excluding stablecoins, the relationship between Bitcoin and gold, and the behavior of USDT dominance, to support his bearish outlook.

7. The presenter acknowledges the possibility of a relief rally, but cautions that it may not necessarily lead to a sustained recovery in the altcoin market. He suggests that the altcoin market may continue to underperform Bitcoin, and that Bitcoin dominance could reach levels around 60% before a more significant pullback occurs.

8. The presenter discusses the potential impact of the upcoming Bitcoin halving event, noting that if the bulls are unable to push Bitcoin above the 8WE SMA by the end of the current week, the following week could be crucial in determining the market's direction. He suggests that a failure to rally above the 8WE SMA could lead to a capitulation and a larger drop towards the bull market support band around $53-54k.

9. The presenter also examines the relationship between the US dollar index (DXY) and the cryptocurrency market, noting that a rally in the US dollar typically leads to a devaluation of other currencies against the US dollar, which can negatively impact high-risk assets like altcoins and benefit low-risk assets like Bitcoin.

10. The presenter acknowledges that while a ""left-translated"" market cycle, where the market continues to rally into the summer, is a possibility, it is not his base case. He emphasizes that his strategy has been to maintain a Bitcoin-heavy portfolio, converting his altcoin holdings to Bitcoin in early 2022 and selectively buying Bitcoin at the lows, as he believes this approach minimizes downside risk and provides exposure to the upside potential of Bitcoin.

11. The presenter further reinforces the importance of maintaining a Bitcoin-heavy portfolio, as he believes that no matter what happens, Bitcoin dominance is likely to increase. He suggests that this strategy provides exposure to the upside potential of Bitcoin while minimizing downside risk, even though Bitcoin may still experience a significant drop at some point in the future.

12. The presenter acknowledges the possibility of being wrong in his analysis and maintains a small allocation to Bitcoin as a hedge, in case his bearish outlook does not materialize and Bitcoin continues to rally to higher levels.","The video provides a cautionary outlook on the cryptocurrency market, suggesting that the current macroeconomic conditions and Federal Reserve's monetary policy may not be favorable for altcoins, and Bitcoin dominance is likely to increase.",https://www.youtube.com/watch?v=AwqI3fDVbp8,Youtube,Bitcoin: Dubious Speculation,53977,2024-04-17 00:00:00,3819,Benjamin Cowen
6,Benjamin Cowen,ETH/BTC Has Fallen!,https://www.youtube.com/watch?v=gLkNGuLT38E,"The transcript discusses the Ethereum-Bitcoin (ETH/BTC) ratio and its implications for the valuation of Ethereum (ETH) in US dollars (USD). The speaker has been tracking the ETH/BTC ratio for a long time and has previously expressed bullish views on it, believing it was undervalued. However, the speaker now sees similarities between the current ETH/BTC pattern and the Bitcoin USD ""wolf distribution"" pattern, suggesting a potential capitulation phase for ETH.

The speaker argues that when the ETH/BTC ratio breaks down, it has historically been followed by a significant drop in the ETH/USD valuation, with examples of 54% and 68% declines in the past. The speaker believes this could happen again, potentially leading to ETH/USD dropping to around $2,000, which was a previous support and resistance level. The speaker suggests that this drop in ETH/USD could occur even in the absence of a recession, as it is primarily driven by the changing monetary policy environment.

The speaker remains more bullish on Bitcoin (BTC) compared to ETH, believing that BTC is a safer bet during periods of quantitative tightening. The speaker also dismisses some of the narratives around Ethereum, such as the impact of regulation or the spot ETF rejection, arguing that these factors are not the primary drivers of ETH's valuation.

The speaker believes that ETH/BTC has entered the final capitulation phase and could potentially bottom out as early as June 2023, but this will depend on the Federal Reserve's monetary policy decisions. The speaker suggests that if the Fed does not pivot to easing until later, the bottom for ETH/BTC could take longer to materialize. The speaker also warns that the altcoin market, including ETH, could face significant declines similar to the previous cycle, where altcoins lost around 72% of their USD valuation.

Overall, the transcript presents a bearish outlook on Ethereum's USD valuation, with the speaker suggesting that the breakdown in the ETH/BTC ratio is a significant event that investors should pay attention to, as it could lead to a substantial decline in ETH/USD.","The speaker expects the Ethereum-Bitcoin ratio to enter a capitulation phase, potentially leading to a significant decline in Ethereum's US dollar valuation.",https://www.youtube.com/watch?v=gLkNGuLT38E,Youtube,ETH/BTC Has Fallen!,73261,2024-04-16 00:00:00,3138,Benjamin Cowen
7,Benjamin Cowen,Bitcoin: The 2024 Halving,https://www.youtube.com/watch?v=wf19QDH7EG8,"The refined and expanded summary is as follows:

The video transcript discusses the upcoming Bitcoin halving event and its potential impact on the cryptocurrency market. The speaker acknowledges that making accurate price predictions is challenging, but revisits a previous forecast he made in 2020 that Bitcoin could reach $40-50,000 by the fourth halving.

The speaker presents two potential scenarios for the market's behavior after the halving. The first is a ""left-translated peak"" where the market tops out earlier than historical cycles, potentially in 2024 rather than 2025. The reasoning is that Bitcoin has already reached new all-time highs before the halving, which is unprecedented. The second scenario is a more typical cycle where the market cools off after the halving, potentially dropping to the $40-50,000 range the speaker previously forecasted, before resuming its bull run later in the post-halving year.

The speaker notes that the current high-risk environment going into the halving is different compared to previous cycles. However, the speaker leans more towards the second scenario of the market aligning with historical patterns, citing evidence that Bitcoin's performance relative to Ethereum has been correlated with monetary policy shifts, such as rate cuts followed by a QE bull market.

The speaker acknowledges that if Bitcoin continues to accelerate after the halving, it would lend more merit to the idea of a left-translated top. However, if Bitcoin cools off into the summer, it would suggest a similar pattern to the previous cycle, with an intermediate market cooldown before a final push higher.

The speaker revisits his 2020 prediction of Bitcoin reaching $40-50,000 by the fourth halving, noting that the current pre-halving price of $64,000 is higher than his previous forecast. The speaker suggests that the fair value of Bitcoin, based on regression analysis, is around $52,000, but could potentially be in the $40-50,000 range if the chart is updated. The speaker emphasizes the difficulty in accurately predicting these markets and acknowledges that the current price being above the fair value range does not necessarily mean the world is ""falling apart.""

Overall, the transcript takes a balanced, analytical approach, weighing the merits of differing viewpoints on how the market may evolve after the halving. The main message is that while this cycle appears atypical, there is still a reasonable case for it following a similar pattern to previous cycles, with the potential for an intermediate market cooldown before a final push higher.","The video discusses the upcoming Bitcoin halving and its potential impact, with the speaker presenting two scenarios while acknowledging the difficulty of accurate price predictions.",https://www.youtube.com/watch?v=wf19QDH7EG8,Youtube,Bitcoin: The 2024 Halving,93485,2024-04-15 00:00:00,1818,Benjamin Cowen
